name,url,height_mdpl,province,image_url,description
Tangkuban Perahu,https://datagunung.com/gunung/Tangkuban Perahu/info,,Unknown,https://datagunung.com/images/mobile-Tangkuban Perahu.webp,"erletak di Desa Ciater, Kabupaten Subang, Provinsi Jawa Barat.
Sejumlah kawah aktif di kawasan Gunung Tangkuban Parahu  Kawah Ratu, Kawah Upas, Kawah Baru dan Kawah Doma.

Jalur pendakian dari kabupaten Bandung Barat:
Via Jayagiri Lembang
Via Sukawana Karyawangi Parongpong"
Sanghyang,https://datagunung.com/gunung/Sanghyang/info,,Unknown,https://datagunung.com/images/mobile-default-image.webp,"Memiliki ketinggian 2.074 mdpl, merupakan gunung strato tidak aktif yang terletak di wilayah vulkanik Bedugul, Senganan, Kecamatan Penebel, Kabupaten Tabanan, Bali.
Dikenal juga dengan nama Gunung Sengjang atau Gunung Sengayang.
Jalur pendakian via jalur utama Bedugul lalu ke Bukit Wanagiri dan Desa Tamblingan."
Pohen,https://datagunung.com/gunung/Pohen/info,,Unknown,https://datagunung.com/images/mobile-default-image.webp,"Memiliki ketinggian 2063 mdpl, terletak di Kabupaten Tabanan, Bali, Indonesia.
 Kawasan Gunung Pohen ditetapkan sebagai bagian dari Cagar Alam Batukahu."
Bukit Lumut Balai,https://datagunung.com/gunung/Bukit Lumut Balai/info,,Unknown,https://datagunung.com/images/mobile-default-image.webp,Gunung Bukit Lumut Balai berada di provinsi Sumatra Selatan dengan ketinggian 2055 mdpl.
Burangrang,https://datagunung.com/gunung/Burangrang/info,,Unknown,https://datagunung.com/images/mobile-Burangrang.webp,
Ungaran,https://datagunung.com/gunung/Ungaran/info,,Unknown,https://datagunung.com/images/mobile-Ungaran.webp,"Gunung yang ramah untuk pendaki pemula, tergolong jenis Stratovolcano.Pada kawasan ini juga terdapat Candi Gedong Songo. Gunung Ungaran memiliki beberapa puncak yaitu Puncak Ungaran, Gendol, dan Botak."
Gawalise,https://datagunung.com/gunung/Gawalise/info,,Unknown,https://datagunung.com/images/mobile-default-image.webp,Gunung Gawalise berada di provinsi Sulawesi Tengah dengan ketinggian 2023 mdpl.
Hutapanjang,https://datagunung.com/gunung/Hutapanjang/info,,Unknown,https://datagunung.com/images/mobile-default-image.webp,Gunung Hutapanjang berada di provinsi Sumatra Utara dengan ketinggian 2021 mdpl.
Klabat,https://datagunung.com/gunung/Klabat/info,,Unknown,https://datagunung.com/images/mobile-default-image.webp,Gunung Klabat berada di provinsi Sulawesi Utara dengan ketinggian 1995 mdpl.
Belirang Beriti,https://datagunung.com/gunung/Belirang-Beriti/info,,Unknown,https://datagunung.com/images/mobile-default-image.webp,Gunung Belirang-Beriti berada di provinsi Sumatra Selatan dengan ketinggian 1958 mdpl.
Kaba,https://datagunung.com/gunung/Kaba/info,,Unknown,https://datagunung.com/images/mobile-default-image.webp,Gunung Kaba berada di provinsi Bengkulu dengan ketinggian 1952 mdpl.
Sangeang Api,https://datagunung.com/gunung/Sangeang Api/info,,Unknown,https://datagunung.com/images/mobile-default-image.webp,Gunung Sangeang Api berada di provinsi Nusa Tenggara Barat dengan ketinggian 1949 mdpl.
Halimun,https://datagunung.com/gunung/Halimun/info,,Unknown,https://datagunung.com/images/mobile-Halimun.webp,"Bertipe Stratovolcano terletak di Kabupaten Bogor dan Kabupaten Sukabumi (Jawa Barat) serta Kabupaten Lebak (Banten). Memiliki ketinggian 1.929 mdpl. Termasuk ke dalam kawasan wilayah Taman Nasional Gunung Halimun-Salak (TNGHS).
“Halimun’“ dalam bahasa Sunda berarti ""berawan"" atau ""berkabut""."
Tapak,https://datagunung.com/gunung/Tapak/info,,Unknown,https://datagunung.com/images/mobile-default-image.webp,"Memiliki ketinggian 1909 mdpl, terletak di daerah Bedugul, Bali.
Beberapa  jalur pendakian: 
- Via Kebun Raya Eka Bedugul.
- Via kawasan bekas Geotermal Bedugul."
Halau Halau,https://datagunung.com/gunung/Halau-Halau/info,,Unknown,https://datagunung.com/images/mobile-default-image.webp,"Gunung Halau-Halau atau Gunung Besar adalah gunung yang berlokasi di perbatasan tiga kabupaten, yaitu kabupaten Tanah Bumbu, kabupaten Hulu Sungai Tengah dan  Kabupaten Hulu Sungai Selatan, Kalimantan Selatan.

Gunung Halau-Halau Memiliki ketinggian 1901 mdpl, merupakan puncak tertinggi di Kalimantan Selatan."
Telomoyo,https://datagunung.com/gunung/Telomoyo/info,,Unknown,https://datagunung.com/images/mobile-Telomoyo.webp,"Gunung Telomoyo berada di area kecamatan Ngablak dan Grabag, wilayah perbatasan antara Kabupaten Semarang dan Kabupaten Magelang, Jawa Tengah.
Pengunjung dapat mendaki gunung Telomoyo melalui jalur trekking, menggunakan transportasi mobil atau motor."
Ranau,https://datagunung.com/gunung/Ranau/info,,Unknown,https://datagunung.com/images/mobile-default-image.webp,Gunung Ranau berada di provinsi Sumatra Selatan dengan ketinggian 1881 mdpl.
Lesung,https://datagunung.com/gunung/Lesung/info,,Unknown,https://datagunung.com/images/mobile-default-image.webp,"Memiliki ketinggian 1865 mdpl, terletak di Desa Munduk, Kecamatan Banjar, Kabupaten Buleleng, Bali.
Jalur pendakian:
- Via Desa Tamblingan
- Via  Desa Kayuputih"
Lubukraya,https://datagunung.com/gunung/Lubukraya/info,,Unknown,https://datagunung.com/images/mobile-default-image.webp,Gunung Lubukraya berada di provinsi Sumatra Utara dengan ketinggian 1862 mdpl.
Adeng,https://datagunung.com/gunung/Adeng/info,,Unknown,https://datagunung.com/images/mobile-default-image.webp,"Memiliki ketinggian 1826 mdpl, terletak di Kecamatan Baturiti, Kabupaten Tabanan, Bali.

Pendakian dapat dimulai dari Desa Angseri, melalui kawasan wisata Bedugul."
Sibualbuali,https://datagunung.com/gunung/Sibualbuali/info,,Unknown,https://datagunung.com/images/mobile-default-image.webp,Gunung Sibualbuali berada di provinsi Sumatra Utara dengan ketinggian 1819 mdpl.
Manglayang,https://datagunung.com/gunung/Manglayang/info,,Unknown,https://datagunung.com/images/mobile-default-image.webp,Gunung Manglayang berada di provinsi Jawa Barat dengan ketinggian 1818 mdpl.
Seulawah Agam,https://datagunung.com/gunung/Seulawah Agam/info,,Unknown,https://datagunung.com/images/mobile-default-image.webp,Gunung Seulawah Agam berada di provinsi Aceh dengan ketinggian 1810 mdpl.
Ambang,https://datagunung.com/gunung/Ambang/info,,Unknown,https://datagunung.com/images/mobile-default-image.webp,Gunung Ambang berada di provinsi Sulawesi Utara dengan ketinggian 1795 mdpl.
Sidole,https://datagunung.com/gunung/Sidole/info,,Unknown,https://datagunung.com/images/mobile-default-image.webp,"Terletak di Parigi Moutong, Sulawesi Tengah, Indonesia. Tepatnya di daerah perbatasan Kabupaten Donggala dan Kabupaten Parigi Moutong.
Gunung Sidole memiliki ketinggian 1785 mdpl.
Pendakian dapat dimulai dari sisi Barat melalui desa Taripa Kecamatan Sindue di Donggala. Pendakian melalui jalur Timur dapat dimulai dari desa Alo'o, kecamatan Ampibabo Parigi Moutong."
Karangetang,https://datagunung.com/gunung/Karangetang/info,,Unknown,https://datagunung.com/images/mobile-Karangetan.webp,Gunung Karangetang berada di provinsi Sulawesi Utara dengan ketinggian 1784 mdpl.
Soputan,https://datagunung.com/gunung/Soputan/info,,Unknown,https://datagunung.com/images/mobile-default-image.webp,Gunung Soputan berada di provinsi Sulawesi Utara dengan ketinggian 1784 mdpl.
Karang,https://datagunung.com/gunung/Karang/info,,Unknown,https://datagunung.com/images/mobile-default-image.webp,Gunung Karang berada di provinsi Banten dengan ketinggian 1778 mdpl.
Kerenceng,https://datagunung.com/gunung/Kerenceng/info,,Unknown,https://datagunung.com/images/mobile-default-image.webp,"Gunung Kerenceng terletak di Kabupaten Sumedang, Provinsi Jawa Barat, tepatnya di perbatasan Kabupaten Sumedang dan Cicalengka, Kabupaten Bandung. 
Gunung Kerenceng memiliki ketinggian 1754 mdpl.

Untuk mencapai lokasi gunung ini, dapat dijangkau dengan transportasi umum ke arah Garut dan turun di Baypass Cicalengka. Dari pasar Cicalengka dapat menggunakan ojek ke arah Desa Jambu Air atau Desa Situhiang. 
Terdapat 2 jalur pendakian yaitu dari Kampung Jambu Air atau melalui jalur Kampung Situhiang yang berada di Desa Tegal Manggung."
Kelud,https://datagunung.com/gunung/Kelud/info,,Unknown,https://datagunung.com/images/mobile-default-image.webp,Gunung Kelud berada di provinsi Jawa Timur dengan ketinggian 1731 mdpl.
Tidore,https://datagunung.com/gunung/Tidore/info,,Unknown,https://datagunung.com/images/mobile-default-image.webp,Gunung Tidore berada di provinsi Maluku Utara dengan ketinggian 1730 mdpl.
Kamojang,https://datagunung.com/gunung/Kamojang/info,,Unknown,https://datagunung.com/images/mobile-default-image.webp,Gunung Kamojang berada di provinsi Jawa Barat dengan ketinggian 1730 mdpl.
Andong,https://datagunung.com/gunung/Andong/info,,Unknown,https://datagunung.com/images/mobile-Andong.webp,"Terletak di Desa Ngablak di Kecamatan Ngablak dan Desa Tlogorejo di Kecamatan Grabag, Kabupaten Magelang, Jawa Tengah.
Gunung Andong bersebelahan dengan Gunung Telomoyo. Pada lereng Gunung Andong terdapat Hutan Wisata Mangli. 
Gunung Andong memiliki 4 puncak: Puncak Makam, Jiwa, Andong, dan Alap-alap."
Sekincau Belirang,https://datagunung.com/gunung/Sekincau Belirang/info,,Unknown,https://datagunung.com/images/mobile-default-image.webp,Gunung Sekincau Belirang berada di provinsi Lampung dengan ketinggian 1719 mdpl.
Batur,https://datagunung.com/gunung/Batur/info,,Unknown,https://images.unsplash.com/photo-1508591086314-d7deb00cede9?ixlib=rb-4.0.3&ixid=MnwxMjA3fDB8MHxwaG90by1wYWdlfHx8fGVufDB8fHx8&auto=format&fit=crop&w=800&h=450&q=80,"Terletak di kecamatan Kintamani, kabupaten Bangli, Bali.
Memiliki beberapa rute pendakian diantaranya:
- Via Pura Pasar Agung
- Via Toya Bungkah 
- Via Serongga
- Via Bukit Mentik

Di Gunung Batur terdapat aliran air yang mengalir ke Danau Batur, danau terbesar di Bali."
Gamalama,https://datagunung.com/gunung/Gamalama/info,,Unknown,https://datagunung.com/images/mobile-Gamalama.webp,"Gunung Gamalama merupakan gunung berapi aktif yang berada di pulau Ternate, provinsi Maluku Utara."
Egon,https://datagunung.com/gunung/Egon/info,,Unknown,https://datagunung.com/images/mobile-default-image.webp,Gunung Egon berada di provinsi Nusa Tenggara Timur dengan ketinggian 1703 mdpl.
Lewotobi Perempuan,https://datagunung.com/gunung/Lewotobi Perempuan/info,,Unknown,https://datagunung.com/images/mobile-default-image.webp,Gunung Lewotobi Perempuan berada di provinsi Nusa Tenggara Timur dengan ketinggian 1703 mdpl.
Perbakti,https://datagunung.com/gunung/Perbakti/info,,Unknown,https://datagunung.com/images/mobile-default-image.webp,Gunung Perbakti berada di provinsi Jawa Barat dengan ketinggian 1699 mdpl.
Tampomas,https://datagunung.com/gunung/Tampomas/info,,Unknown,https://datagunung.com/images/mobile-default-image.webp,"Terletak di sebelah utara kawasan perkotaan Sumedang. Bertipe Stratovolkano. 
Puncak Gunung Tampomas yang dikenal dengan nama Puncak Sanghiyang Taraje
Terrmasuk dalam area Taman Wisata Alam Gunung Tampomas.
Di kaki Gunung Tampomas terdapat Curug Ciputrawangi

Jalur Pendakian:
Untuk mencapai kawasan puncak Tampomas, ada beberapa jalur pendakian. 
Jalur Narimbang. Di pos pendakian Narimbang terdapat mata air dan curug Ciputrawangi yang terkenal. 
Jalur Cibeureum."
Poco Leok,https://datagunung.com/gunung/Poco Leok/info,,Unknown,https://datagunung.com/images/mobile-default-image.webp,Gunung Poco Leok berada di provinsi Nusa Tenggara Timur dengan ketinggian 1675 mdpl.
Manimporok,https://datagunung.com/gunung/Manimporok/info,,Unknown,https://datagunung.com/images/mobile-default-image.webp,Gunung Manimporok berada di provinsi Sulawesi Selatan dengan ketinggian 1661 mdpl.
Iliboleng,https://datagunung.com/gunung/Iliboleng/info,,Unknown,https://datagunung.com/images/mobile-default-image.webp,Gunung Iliboleng berada di provinsi Nusa Tenggara Timur dengan ketinggian 1659 mdpl.
Penanggungan,https://datagunung.com/gunung/Penanggungan/info,,Unknown,https://datagunung.com/images/mobile-Penanggungan.webp,"Gunung Penanggungan berada sekitar 55 kilometer sebelah timur Kota Surabaya, dekat dengan kota Mojokerto dan Pasuruan. Gunung Penanggungan memiliki ketinggian sekitar 1.653 meter di atas permukaan laut.

Gunung Penanggungan memiliki sejarah dan kebudayaan yang kaya. Pada abad ke-11 hingga ke-15, gunung ini menjadi pusat kerajaan Hindu dan Buddha di Jawa Timur. Terdapat banyak situs bersejarah yang masih dapat ditemukan di sekitar Gunung Penanggungan, seperti candi-candi dan peninggalan arkeologi lainnya.

Terdapat beberapa kompleks candi di area Gunung Penanggungan seperti Gentong, Wisnu, Jolutundo dan Bayi.

Selain nilai sejarah dan arkeologisnya, Gunung Penanggungan juga menawarkan panorama alam yang menakjubkan. Terdapat beberapa jalur pendakian yang dapat dipilih oleh para pendaki, seperti jalur dari Jolotundo, Tamiajeng atau Kedungudi. Pendakian ke puncak gunung ini relatif mudah, dan pemandangan yang ditemui di puncak akan memuaskan para pendaki."
Lamongan,https://datagunung.com/gunung/Lamongan/info,,Unknown,https://datagunung.com/images/mobile-default-image.webp,Gunung Lamongan berada di provinsi Jawa Timur dengan ketinggian 1651 mdpl.
Kelimutu,https://datagunung.com/gunung/Kelimutu/info,,Unknown,https://datagunung.com/images/mobile-default-image.webp,Gunung Kelimutu berada di provinsi Nusa Tenggara Timur dengan ketinggian 1639 mdpl.
Gamkonora,https://datagunung.com/gunung/Gamkonora/info,,Unknown,https://datagunung.com/images/mobile-default-image.webp,Gunung Gamkonora berada di provinsi Maluku Utara dengan ketinggian 1635 mdpl.
Muria,https://datagunung.com/gunung/Muria/info,,Unknown,https://datagunung.com/images/mobile-default-image.webp,Gunung Muria berada di provinsi Jawa Tengah dengan ketinggian 1625 mdpl.
Magaringsai,https://datagunung.com/gunung/Magaringsai/info,,Unknown,https://datagunung.com/images/mobile-default-image.webp,"Terletak di kawasan desa Lok Lahung kandangan, kabupaten Hulu Sungai Selatan, Kalimantan Selatan.
Jalur pendakian via desa Manakili.
Gunung Magaringsai memiki ketinggian 1600 mdpl."
Saeng,https://datagunung.com/gunung/Saeng/info,,Unknown,https://datagunung.com/images/mobile-default-image.webp,"Gunung Saeng terletak di Bondowoso, berdekatan dengan Gunung Piramid. Jalur pendakian dapat ditempuh melalui Desa Ardisaeng atau melalui Sumber Waru, Binakal.

Perhutani KPH Bondowoso secara resmi melarang aktivitas pendakian di Gunung Saeng terhitung sejak 7 Mei 2025. Keputusan ini diambil dengan mempertimbangkan risiko kecelakaan akibat medan pendakian yang curam."
Lewotobi Laki laki,https://datagunung.com/gunung/Lewotobi Laki-laki/info,,Unknown,https://datagunung.com/images/mobile-default-image.webp,Gunung Lewotobi Laki-laki berada di provinsi Nusa Tenggara Timur dengan ketinggian 1584 mdpl.
Lokon,https://datagunung.com/gunung/Lokon/info,,Unknown,https://datagunung.com/images/mobile-default-image.webp,Gunung Lokon berada di provinsi Sulawesi Utara dengan ketinggian 1580 mdpl.
Lokon Empung,https://datagunung.com/gunung/Lokon-Empung/info,,Unknown,https://datagunung.com/images/mobile-default-image.webp,Gunung Lokon-Empung berada di provinsi Sulawesi Utara dengan ketinggian 1580 mdpl.
Inielika,https://datagunung.com/gunung/Inielika/info,,Unknown,https://datagunung.com/images/mobile-default-image.webp,Gunung Inielika berada di provinsi Nusa Tenggara Timur dengan ketinggian 1559 mdpl.
Sempu,https://datagunung.com/gunung/Sempu/info,,Unknown,https://datagunung.com/images/mobile-default-image.webp,Gunung Sempu berada di provinsi Sulawesi Utara dengan ketinggian 1549 mdpl.
Kiaraberes Gagak,https://datagunung.com/gunung/Kiaraberes-Gagak/info,,Unknown,https://datagunung.com/images/mobile-default-image.webp,Gunung Kiaraberes-Gagak berada di provinsi Jawa Barat dengan ketinggian 1511 mdpl.
Imun,https://datagunung.com/gunung/Imun/info,,Unknown,https://datagunung.com/images/mobile-default-image.webp,Gunung Imun berada di provinsi Sumatra Utara dengan ketinggian 1505 mdpl.
Sukaria,https://datagunung.com/gunung/Sukaria/info,,Unknown,https://datagunung.com/images/mobile-default-image.webp,Gunung Sukaria berada di provinsi Nusa Tenggara Timur dengan ketinggian 1500 mdpl.
Kahung,https://datagunung.com/gunung/Kahung/info,,Unknown,https://datagunung.com/images/mobile-default-image.webp,"Gunung Kahung memiliki ketinggian 1456 mdpl, terletak di desa Belangian, kecamatan Aranio, kabupaten Banjar, Kalimantan Selatan.

Jalur pendakian bisa dimulai dari Banjarbaru menuju ke arah desa Tiwingan, perjalanan dilanjutkan dengan menggunakan perahu bermesin atau disebut ‘kelotok’."
Lewotolo,https://datagunung.com/gunung/Lewotolo/info,,Unknown,https://datagunung.com/images/mobile-default-image.webp,Gunung Lewotolo berada di provinsi Nusa Tenggara Timur dengan ketinggian 1423 mdpl.
Ili Lewotolok,https://datagunung.com/gunung/Ili Lewotolok/info,,Unknown,,Gunung Ili Lewotolok berada di provinsi  dengan ketinggian 1423 mdpl.
Punikan,https://datagunung.com/gunung/Punikan/info,,Unknown,https://datagunung.com/images/mobile-default-image.webp,Gunung Punikan berada di provinsi Nusa Tenggara Barat dengan ketinggian 1418 mdpl.
Merbuk,https://datagunung.com/gunung/Merbuk/info,,Unknown,https://datagunung.com/images/mobile-default-image.webp,Gunung Merbuk berada di provinsi Bali dengan ketinggian 1386 mdpl.
Kie Besi,https://datagunung.com/gunung/Kie Besi/info,,Unknown,https://datagunung.com/images/mobile-default-image.webp,Gunung Kie Besi berada di provinsi Maluku Utara dengan ketinggian 1357 mdpl.
Bulu Saraung,https://datagunung.com/gunung/Bulu Saraung/info,,Unknown,https://datagunung.com/images/mobile-default-image.webp,"Gunung ini berada di desa Tompio Bulu Kabupaten Pangkep, Sulawesi Selatan dan memiliki ketinggian sekitar 1.353 mdpl.
Gunung ini termasuk dalam kawasan Taman Nasional Bantimurung Bulusaraung dan habitat kera hitam dari berbagai macam kupu-kupu."
Pulosari,https://datagunung.com/gunung/Pulosari/info,,Unknown,https://datagunung.com/images/mobile-default-image.webp,Gunung Pulosari berada di provinsi Banten dengan ketinggian 1346 mdpl.
Dukono,https://datagunung.com/gunung/Dukono/info,,Unknown,https://datagunung.com/images/mobile-Dukono.webp,"Gunung Dukono adalah sebuah gunung berapi yang terletak di pulau Halmahera, bagian dari provinsi Maluku Utara, Indonesia. Gunung ini dikenal sebagai salah satu gunung berapi yang aktif di Indonesia. Dukono terletak di bagian utara Halmahera dan merupakan bagian dari Cincin Api Pasifik, yang merupakan zona seismik aktif di mana sejumlah besar gunung berapi terletak.

Gunung Dukono memiliki ketinggian sekitar 1.335 meter di atas permukaan laut. Berikut adalah beberapa karakteristik umum dari Gunung Dukono:

Aktivitas Erupsi: Gunung Dukono dikenal sebagai gunung berapi yang aktif. Aktivitas erupsi dapat terjadi dengan frekuensi yang bervariasi, dan letusan-letusan kecil hingga sedang sering terjadi.

Bentuk Fisik: Secara morfologi, Gunung Dukono memiliki bentuk kerucut yang curam dengan lereng yang relatif curam. Karena aktivitas vulkaniknya, gunung ini dapat mengalami perubahan bentuk seiring waktu akibat letusan dan aliran lava.

Komposisi Material Vulkanik: Gunung Dukono, seperti kebanyakan gunung berapi di Indonesia, terbentuk dari material vulkanik, termasuk lava, abu vulkanik, dan batuan piroklastik lainnya.

Kawasan Seismik Aktif: Gunung Dukono terletak di Cincin Api Pasifik, yang merupakan kawasan seismik aktif di dunia. Daerah ini dikenal karena aktivitas tektoniknya yang tinggi, termasuk pertemuan lempeng tektonik yang dapat menyebabkan gempa bumi dan letusan gunung berapi.

Kawasan Rawan Bencana: Sebagai gunung berapi aktif, daerah sekitar Gunung Dukono dianggap rawan bencana. Erupsi dapat menghasilkan aliran piroklastik, awan panas, lahar, dan hujan abu vulkanik, yang semuanya dapat menjadi ancaman bagi masyarakat yang tinggal di sekitarnya."
Hauk,https://datagunung.com/gunung/Hauk/info,,Unknown,https://datagunung.com/images/mobile-default-image.webp,"Gunung Hauk berlokasi di  Desa Ajung, Kecamatan Tinggi, Kabupaten Balangan, Kalimantan Selatan.
Gunung Hauk memiliki ketinggian 1325 mdpl, merupakan rangkaian dari pegunungan Meratus.
Jalur pendakian melalui desa Ajung, yang bisa diakses dari Barabai-Birayang ataupun Paringin/ Balangan.

Pendakian menempuh jalan darat juga termasuk menyeberangi sungai."
Ibu,https://datagunung.com/gunung/Ibu/info,,Unknown,https://datagunung.com/images/mobile-default-image.webp,Gunung Ibu berada di provinsi Maluku Utara dengan ketinggian 1325 mdpl.
Mahawu,https://datagunung.com/gunung/Mahawu/info,,Unknown,https://datagunung.com/images/mobile-default-image.webp,Gunung Mahawu berada di provinsi Sulawesi Utara dengan ketinggian 1324 mdpl.
Awu,https://datagunung.com/gunung/Awu/info,,Unknown,https://datagunung.com/images/mobile-default-image.webp,Gunung Awu berada di provinsi Sulawesi Utara dengan ketinggian 1320 mdpl.
Sanggabuana,https://datagunung.com/gunung/Sanggabuana/info,,Unknown,https://datagunung.com/images/mobile-default-image.webp,Gunung Sanggabuana berada di provinsi Jawa Barat dengan ketinggian 1291 mdpl.
Rorokoan,https://datagunung.com/gunung/Rorokoan/info,,Unknown,https://datagunung.com/images/mobile-default-image.webp,"Gunung Rorokoan dengan ketinggian 1284 mdpl, terletak di kawasan wisata Loksado, kabupaten Hulu Sungai Selatan, Kalimantan Selatan."
Rajabasa,https://datagunung.com/gunung/Rajabasa/info,,Unknown,https://datagunung.com/images/mobile-default-image.webp,Gunung Rajabasa berada di provinsi Lampung dengan ketinggian 1281 mdpl.
Baluran,https://datagunung.com/gunung/Baluran/info,,Unknown,https://datagunung.com/images/mobile-default-image.webp,Gunung Baluran berada di provinsi Jawa Timur dengan ketinggian 1247 mdpl.
Tampusu,https://datagunung.com/gunung/Tampusu/info,,Unknown,https://datagunung.com/images/mobile-default-image.webp,Gunung Tampusu berada di provinsi Sulawesi Utara dengan ketinggian 1206 mdpl.
Tondano,https://datagunung.com/gunung/Tondano/info,,Unknown,https://datagunung.com/images/mobile-default-image.webp,Gunung Tondano berada di provinsi Sulawesi Utara dengan ketinggian 1202 mdpl.
Aseupan,https://datagunung.com/gunung/Aseupan/info,,Unknown,https://datagunung.com/images/mobile-default-image.webp,Gunung Aseupan berada di provinsi Banten dengan ketinggian 1174 mdpl.
Karaha,https://datagunung.com/gunung/Karaha/info,,Unknown,https://datagunung.com/images/mobile-default-image.webp,Gunung Karaha berada di provinsi Jawa Barat dengan ketinggian 1155 mdpl.
Tilu,https://datagunung.com/gunung/Tilu/info,,Unknown,https://datagunung.com/images/mobile-Tilu.webp,"Terletak dekat perbatasan Kabupaten Kuningan, Jawa Barat dan Kabupaten Brebes, Jawa Tengah.
Gunung Tilu yang diantaranya memiliki memiliki beberapa puncak tertinggi yaitu puncak Gunung Tilu (1.076 mdpl), puncak Sukmana (1.154 mdpl) dan satu puncak (1.112 mdpl)."
Tongkoko,https://datagunung.com/gunung/Tongkoko/info,,Unknown,https://datagunung.com/images/mobile-default-image.webp,Gunung Tongkoko berada di provinsi Sulawesi Utara dengan ketinggian 1149 mdpl.
Jailolo,https://datagunung.com/gunung/Jailolo/info,,Unknown,https://datagunung.com/images/mobile-default-image.webp,Gunung Jailolo berada di provinsi Maluku Utara dengan ketinggian 1130 mdpl.
Leroboleng,https://datagunung.com/gunung/Leroboleng/info,,Unknown,https://datagunung.com/images/mobile-default-image.webp,Gunung Leroboleng berada di provinsi Nusa Tenggara Timur dengan ketinggian 1117 mdpl.
Bulu Monrolo,https://datagunung.com/gunung/Bulu Monrolo/info,,Unknown,https://datagunung.com/images/mobile-default-image.webp,Gunung Bulu Monrolo berada di provinsi Sulawesi Selatan dengan ketinggian 1109 mdpl.
Helatoba Tarutung,https://datagunung.com/gunung/Helatoba-Tarutung/info,,Unknown,https://datagunung.com/images/mobile-default-image.webp,Gunung Helatoba-Tarutung berada di provinsi Sumatra Utara dengan ketinggian 1100 mdpl.
Ilimuda,https://datagunung.com/gunung/Ilimuda/info,,Unknown,https://datagunung.com/images/mobile-default-image.webp,Gunung Ilimuda berada di provinsi Nusa Tenggara Timur dengan ketinggian 1100 mdpl.
Hulubelu,https://datagunung.com/gunung/Hulubelu/info,,Unknown,https://datagunung.com/images/mobile-default-image.webp,Gunung Hulubelu berada di provinsi Lampung dengan ketinggian 1040 mdpl.
Tobaru,https://datagunung.com/gunung/Tobaru/info,,Unknown,https://datagunung.com/images/mobile-default-image.webp,Gunung Tobaru berada di provinsi Maluku Utara dengan ketinggian 1035 mdpl.
Amasing,https://datagunung.com/gunung/Amasing/info,,Unknown,https://datagunung.com/images/mobile-default-image.webp,Gunung Amasing berada di provinsi Maluku Utara dengan ketinggian 1030 mdpl.
Ililabalekan,https://datagunung.com/gunung/Ililabalekan/info,,Unknown,https://datagunung.com/images/mobile-default-image.webp,Gunung Ililabalekan berada di provinsi Nusa Tenggara Timur dengan ketinggian 1018 mdpl.
Iliwerung,https://datagunung.com/gunung/Iliwerung/info,,Unknown,https://datagunung.com/images/mobile-default-image.webp,Gunung Iliwerung berada di provinsi Nusa Tenggara Timur dengan ketinggian 1018 mdpl.
Suoh,https://datagunung.com/gunung/Suoh/info,,Unknown,https://datagunung.com/images/mobile-default-image.webp,Gunung Suoh berada di provinsi Lampung dengan ketinggian 1000 mdpl.
Todoko Ranu,https://datagunung.com/gunung/Todoko-Ranu/info,,Unknown,https://datagunung.com/images/mobile-default-image.webp,Gunung Todoko-Ranu berada di provinsi Maluku Utara dengan ketinggian 979 mdpl.
Bongkok,https://datagunung.com/gunung/Bongkok/info,,Unknown,https://datagunung.com/images/mobile-default-image.webp,"Gunung Bongkok adalah sebuah gunung yang terletak di Kabupaten Purwakarta, Jawa Barat. 

Nama ""Bongkok"" sendiri berasal dari bentuk puncaknya yang terlihat membungkuk atau melengkung, sehingga mudah dikenali dari kejauhan.

Bagi para pendaki dan pecinta alam, Gunung Bongkok menawarkan jalur pendakian yang cukup menantang namun masih dapat dijangkau oleh pendaki pemula. Dari puncaknya, pengunjung bisa menikmati pemandangan indah Kabupaten Purwakarta dan sekitarnya."
