name,url,height_mdpl,province,image_url,description
Moti,https://datagunung.com/gunung/Moti/info,,Unknown,https://datagunung.com/images/mobile-default-image.webp,Gunung Moti berada di provinsi Maluku Utara dengan ketinggian 950 mdpl.
Wai Sano,https://datagunung.com/gunung/Wai Sano/info,,Unknown,https://datagunung.com/images/mobile-default-image.webp,Gunung Wai Sano berada di provinsi Nusa Tenggara Timur dengan ketinggian 903 mdpl.
Bibinoi,https://datagunung.com/gunung/Bibinoi/info,,Unknown,https://datagunung.com/images/mobile-default-image.webp,Gunung Bibinoi berada di provinsi Maluku Utara dengan ketinggian 900 mdpl.
Paluweh,https://datagunung.com/gunung/Paluweh/info,,Unknown,https://datagunung.com/images/mobile-default-image.webp,Gunung Paluweh berada di provinsi Nusa Tenggara Timur dengan ketinggian 875 mdpl.
Wurlali,https://datagunung.com/gunung/Wurlali/info,,Unknown,https://datagunung.com/images/mobile-default-image.webp,Gunung Wurlali berada di provinsi Maluku dengan ketinggian 868 mdpl.
Sirung,https://datagunung.com/gunung/Sirung/info,,Unknown,https://datagunung.com/images/mobile-default-image.webp,Gunung Sirung berada di provinsi Nusa Tenggara Timur dengan ketinggian 862 mdpl.
Krakatau,https://datagunung.com/gunung/Krakatau/info,,Unknown,https://datagunung.com/images/mobile-default-image.webp,Gunung Krakatau berada di provinsi Lampung dengan ketinggian 813 mdpl.
Nila,https://datagunung.com/gunung/Nila/info,,Unknown,https://datagunung.com/images/mobile-default-image.webp,Gunung Nila berada di provinsi Maluku dengan ketinggian 781 mdpl.
Ndete Napu,https://datagunung.com/gunung/Ndete Napu/info,,Unknown,https://datagunung.com/images/mobile-default-image.webp,Gunung Ndete Napu berada di provinsi Nusa Tenggara Timur dengan ketinggian 750 mdpl.
Batu Tara,https://datagunung.com/gunung/Batu Tara/info,,Unknown,https://datagunung.com/images/mobile-default-image.webp,Gunung Batu Tara berada di provinsi Nusa Tenggara Timur dengan ketinggian 748 mdpl.
Ruang,https://datagunung.com/gunung/Ruang/info,,Unknown,https://datagunung.com/images/mobile-default-image.webp,Gunung Ruang berada di provinsi Sulawesi Utara dengan ketinggian 725 mdpl.
Malang,https://datagunung.com/gunung/Malang/info,,Unknown,https://datagunung.com/images/mobile-default-image.webp,Gunung Malang berada di provinsi Jawa Barat dengan ketinggian 680 mdpl.
Teon,https://datagunung.com/gunung/Teon/info,,Unknown,https://datagunung.com/images/mobile-default-image.webp,Gunung Teon berada di provinsi Nusa Tenggara Timur dengan ketinggian 655 mdpl.
Serua,https://datagunung.com/gunung/Serua/info,,Unknown,https://datagunung.com/images/mobile-default-image.webp,Gunung Serua berada di provinsi Nusa Tenggara Timur dengan ketinggian 641 mdpl.
Banda Api,https://datagunung.com/gunung/Banda Api/info,,Unknown,https://datagunung.com/images/mobile-default-image.webp,Gunung Banda Api berada di provinsi Maluku dengan ketinggian 640 mdpl.
Iya,https://datagunung.com/gunung/Iya/info,,Unknown,https://datagunung.com/images/mobile-default-image.webp,Gunung Iya berada di provinsi Nusa Tenggara Timur dengan ketinggian 637 mdpl.
Hiri,https://datagunung.com/gunung/Hiri/info,,Unknown,https://datagunung.com/images/mobile-default-image.webp,Gunung Hiri berada di provinsi Maluku Utara dengan ketinggian 630 mdpl.
Weh,https://datagunung.com/gunung/Weh/info,,Unknown,https://datagunung.com/images/mobile-default-image.webp,Gunung Weh berada di provinsi Aceh dengan ketinggian 617 mdpl.
Lurus,https://datagunung.com/gunung/Lurus/info,,Unknown,https://datagunung.com/images/mobile-default-image.webp,Gunung Lurus berada di provinsi Jawa Timur dengan ketinggian 539 mdpl.
Colo,https://datagunung.com/gunung/Colo/info,,Unknown,https://datagunung.com/images/mobile-default-image.webp,Gunung Colo berada di provinsi Sulawesi Tengah dengan ketinggian 507 mdpl.
Tigalalu,https://datagunung.com/gunung/Tigalalu/info,,Unknown,https://datagunung.com/images/mobile-default-image.webp,Gunung Tigalalu berada di provinsi Maluku Utara dengan ketinggian 422 mdpl.
Eusing,https://datagunung.com/gunung/Eusing/info,,Unknown,https://datagunung.com/images/mobile-default-image.webp,"Gunung Eusing berlokasi di Desa Gobang Kecamatan Rumping Kabupaten Bogor. Gunung ini diperkirakan memiliki ketinggian sekitar 360 mdpl, dengan area puncak yang dikenal dengan nama Sumur Tujuh.

Terima kasih rekan Ical di Jakarta yang mengusulkan penambahan data Gunung Eusing."
Tarakan,https://datagunung.com/gunung/Tarakan/info,,Unknown,https://datagunung.com/images/mobile-default-image.webp,Gunung Tarakan berada di provinsi Kalimantan Utara dengan ketinggian 318 mdpl.
Mare,https://datagunung.com/gunung/Mare/info,,Unknown,https://datagunung.com/images/mobile-default-image.webp,Gunung Mare berada di provinsi Maluku Utara dengan ketinggian 308 mdpl.
Gunungapi Wetar,https://datagunung.com/gunung/Gunungapi Wetar/info,,Unknown,https://datagunung.com/images/mobile-default-image.webp,Gunung Gunungapi Wetar berada di provinsi Maluku dengan ketinggian 282 mdpl.
Manuk,https://datagunung.com/gunung/Manuk/info,,Unknown,https://datagunung.com/images/mobile-default-image.webp,Gunung Manuk berada di provinsi Maluku dengan ketinggian 282 mdpl.
Riang Kotang,https://datagunung.com/gunung/Riang Kotang/info,,Unknown,https://datagunung.com/images/mobile-default-image.webp,Gunung Riang Kotang berada di provinsi Nusa Tenggara Timur dengan ketinggian 200 mdpl.
Anak Krakatau,https://datagunung.com/gunung/Anak Krakatau/info,,Unknown,https://datagunung.com/images/mobile-default-image.webp,Gunung Anak Krakatau berada di provinsi Lampung dengan ketinggian 157 mdpl.
